title,price,stock,image_url,description,genre,url
Идиот,7.99,Есть на стоке,https://cdn.librarius.md/img/original/idiot_1645512389.jpeg,"Величайший роман Достоевского. «Идиота» экранизировали 13 раз лучшие постановщики от Индии до Германии — Жорж Лампен и Анджей Жулавский, Акира Куросава и Анджей Вайда, отечественные Пырьев и Бортко. Завораживающая история трагических страстей, связавших купца Парфена Рогожина, бывшую содержанку богатого дворянина Настасью Филипповну и «идеального человека» князя Мышкина — беспомощного идиота в мире корысти и зла, гласящая о том, что сострадание, возможно, единственный закон человеческого бытия. Она по-прежнему актуальна и воспринимается ярко и непосредственно, будто была написана вчера.",Классическая литература,https://librarius.md/ru/book/idiot-680616
Стигмалион,11.99,Есть на стоке,https://cdn.librarius.md/img/original/stigmalion_1645709287.jpg,"Меня зовут Долерс Макбрад, и я с рождения страдаю от очень редкой формы аллергии: прикосновения к другим людям вызывают у меня сильнейшие ожоги. Я не могу поцеловать парня, обнять родителей, выйти из дома, не надев перчаток. Я неприкасаемая. Я словно живу в заколдованном замке, который держит меня в плену и наказывает ожогами и шрамами за каждую попытку ""побега"". Я даже придумала имя для своей тюрьмы: Стигмалион.Меня уже не приводит в отчаяние мысль, что я всю жизнь буду пленницей своего диагноза – и пленницей умру. Я не тешу себя мечтами, что от моей болезни изобретут лекарство, и не рассчитываю, что встречу человека, не оставляющего на мне ожогов...Но до чего же это живучее чувство – надежда. А вдруг я все-таки совершу побег из Стигмалиона? Вдруг и я смогу однажды познать всё это: прикосновения, объятия, поцелуи, безумство, свободу, любовь?.",Универсальная литература,https://librarius.md/ru/book/stigmalion-680554
Крылья,12.99,Есть на стоке,https://cdn.librarius.md/img/original/kryliya_1645709205.jpg,"Семнадцатилетняя Лика Вернер после покушения на её жизнь обнаруживает, что в состоянии стресса может ненадолго перемещаться в тела других людей. Лика уверена, что сходит с ума, пока не встречает человека, который подозрительно хорошо осведомлен о такого рода «симптомах». Захватывающий роман о любви на фоне восхитительных декораций: альпийские предгорья, мегаполисы Европы, улочки крымских городков, пейзажи Тибета и Саудовской Аравии. Роскошная жизнь швейцарской аристократии, тайные организации, закрытые школы, эксперименты над человеческой психикой, чувства, которым невозможно противостоять.","Фэнтези, научная фантастика",https://librarius.md/ru/book/kryliya-680555
Мара и Морок,,Есть на стоке,https://cdn.librarius.md/img/original/mara-i-morok_1644577655.jpg,"Таких, как я, называют Марами — отмеченными самой богиней смерти Мораной. Когда-то у меня и моих шести сестер был свой путь.Тогда люди нас уважали и просили о милосердии. Они приносили нам подношения и молились нам. Но 200 лет назад все изменилось, когда принц Серата осмелился поднять руку на одну из нас.Я пыталась отомстить, но погибли мы все. Теперь правители Аракена, погрязшие в длительной войне со своим соседом Сератом, решили вернуть меня к жизни. Дать второй шанс на месть и свободу, привязав меня к тому, против кого я никогда не пойду. Таких, как он, называют Морок, и их боятся абсолютно все.","Фэнтези, научная фантастика",https://librarius.md/ru/book/mara-i-morok-680478
1984. Скотный двор,13.99,Есть на стоке,https://cdn.librarius.md/img/original/1984-skotnyy-dvor_1637844728.jpg,"Доступно вИмяКонтактыНаличиеLIBRARIUS 407Chisinau, Str. Creangă, 78078 747 407В наличииLIBRARIUS 421Chisinau, str. Ceucari 2/6078747421В наличииLibrarius 446Chisinau, bd. Dacia 16/1079403446В наличии",Зарубежная классическая проза и драматургия,https://librarius.md/ru/book/1984-skotnyy-dvor-675035
Хочу и буду. 6 правил счастливой жизни или Метод Лабковского в действии,,Есть на стоке,https://cdn.librarius.md/img/original/hochu-i-budu-6-pravil-schastlivoy-zhizni-ili-metod-labkovskogo-v-deystvii-dopolnennoe-izdanie_1636612179.jpg,"В новом дополненном издании появилось предисловие и глава, где психолог Михаил Лабковский подробно разбирает каждое правило, говорит о нюансах, и объясняет методику, чтобы применять ее стало проще. Чтобы жить стало легче, понятнее, а главное — счастливее. Михаил Лабковский абсолютно уверен, что человек может и имеет право быть счастливым и делать только то, что он хочет. Его книга о том, как понять себя, обрести гармонию и научиться радоваться жизни. Автор задается вопросом, почему человек не получает от жизни радость и удовольствие : откуда в нас осознанные и бессознательные тревоги, страхи, неумение слушать себя и строить отношения с другими людьми? Отличительная черта подхода Лабковского - в конкретике. На любой самый сложный вопрос он всегда дает предельно доходчивый ответ. Его заявления и советы настолько радикальны, что многим приходится сначала испытать удивление, если не шок. В рекомендациях автор не прячется за обтекаемыми формулировками, а четко называет причины проблем. И самое главное, что он знает, как эту проблему решить - без копания в детских психотравмах и пристального анализа вашего прошлого. Если у человека есть знание и желание, то изменить себя и свою жизнь к лучшему вполне реально. Цель издания этой книги - личное счастье каждого, кто ее прочитает.Знаменитые шесть парвил Михаила Лабковского - в новом дополненном и расширенном издании. Легендарная книга, которая помогла сотням тысяч людей выйти из депрессии после родов, потери работы, разрыва отношений. Заново услышать себя и понять, чего вы сами хотите и кто должен быть рядом с вами. Книга, спопобная изменить ваше самоощущение и жизнь.",Психология,https://librarius.md/ru/book/hochu-i-budu-6-pravil-schastlivoy-zhizni-ili-metod-labkovskogo-v-deystvii-dopolnennoe-izdanie-675155
Это началось не с тебя. Как мы наследуем негативные сценарии,13.99,Есть на стоке,https://cdn.librarius.md/img/original/eto-nachalosi-ne-s-tebya-kak-my-nasleduem-negativnye-scenarii_1646395543.jpeg,"Душевная или физическая боль не возникает сама по себе и не всегда излечивается со временем. Ее корни могут лежать не в нашем жизненном опыте или в химическом дисбалансе мозга — а в жизни наших родителей, бабушек и дедушек и даже прадедушек. Последние научные исследования подтверждают то, что многие уже давно интуитивно понимают — травматический опыт может передаваться из поколения в поколение. В своей книге Марк Уолинн, ведущий специалист по работе с семейной травмой, предлагает техники, которые позволят выявить страхи и тревоги, отражающиеся в повседневных словах, поведении и физических симптомах. ""Это началось не с тебя"" — совершенно новый подход, который позволит преодолеть проблемы, преследующие вашу семью многие поколения.Примеры, приведенные в данной книге, взяты из жизни реальных клиентов автора. В целях сохранения конфиденциальности все имена и обстоятельства были изменены. Любые сходства с реальными людьми случайны.",Личностное развитие и мотивация,https://librarius.md/ru/book/eto-nachalosi-ne-s-tebya-kak-my-nasleduem-negativnye-scenarii-nashey-semii-i-kak-ostanoviti-ih-vliyanie-672210
Мара и Морок. Особенная Тень,,Сток лимитирован,https://cdn.librarius.md/img/original/mara-i-morok-osobennaya-teni_1644577714.jpg,"После предательства Морока Мара живой попадает в руки потомков своего врага. Ей придётся лицом к лицу встретиться с Северином — нынешним королём Серата — и узнать, какую судьбу он приготовил для неё. Ей предстоит разобраться в том, как много лжи таится в её прошлом и настоящем. Ей необходимо найти способ завершить свою давнюю месть. Однако Мара не единственная, кому нужно принять решение. Морок должен сделать выбор, который он больше не может откладывать.","Российская фантастика, фэнтези, мистика",https://librarius.md/ru/book/mara-i-morok-osobennaya-teni-672214
Стань моим завтра,13.99,Есть на стоке,https://cdn.librarius.md/img/original/stani-moim-zavtra_1638605920.jpg,"Доступно вИмяКонтактыНаличиеLIBRARIUS 401Chisinau, Str. Zelinski, 11/1078 747 401В наличииLIBRARIUS 406Chisinau, Str. Zelinski, 7078 747 406В наличииLIBRARIUS 403Chisinau, Str. Puşkin, 22078 747 403В наличииLIBRARIUS 404Chisinau, Ștefan cel Mare și Sfînt 8, (CC UNIC)078 747 404В наличииLIBRARIUS 405Chisinau, Str. Mircea cel Bătrîn, 10078 747 405В наличииLIBRARIUS 409Chisinau, str. L.Tolstoi, 24/1 (mag. Nr.1)078 747 409В наличииLIBRARIUS 407Chisinau, Str. Creangă, 78078 747 407В наличииLIBRARIUS 412Chisinau, Bd. Moscova, 1/1078 747 412В наличииLIBRARIUS 416Chisinau, str. Albișoara, 4 (CC ATRIUM)078 747 416В наличииLIBRARIUS 417Chisinau, str. Calea Ieșilor 5078747417В наличииLIBRARIUS 418Chisinau, bd. Moscovei 9/5078747418В наличииLIBRARIUS 419Chisinau, str. C.Tănase, 6078747419В наличииLIBRARIUS 420Chisinau, str. V. Dokuceaev, 13078747420В наличииLIBRARIUS 421Chisinau, str. Ceucari 2/6078747421В наличииLIBRARIUS 422Chisinau, str. Piața Unirii Principatelor, 3078747422В наличииLibrarius 423Chisinau,  bd. Ștefan cel Mare, 6076607423В наличииLIBRARIUS 424Chisinau, str. Tiraspol, 5078747424В наличииLIBRARIUS 425Chisinau, str. A. Russo, 59/8078747425В наличииLIBRARIUS 429Chisinau, str. Dacia 30/1078747449В наличииLIBRARIUS 434Chisinau, str. Ștefan cel Mare 64078747454В наличииLIBRARIUS 440Chisinau,  str. M. Varlaam, 75078333440В наличииLIBRARIUS 444Chisinau, str. Bogdan Voievod, 1 (Oasis Mall)078011444В наличииLibrarius 445Chisinau, str. Arborilor 21, et 4079366445В наличииLibrarius 446Chisinau, bd. Dacia 16/1079403446В наличии",Сентиментальная проза зарубежных авторов,https://librarius.md/ru/book/stani-moim-zavtra-672215
Бесы,7.99,Сток лимитирован,https://cdn.librarius.md/img/original/besy_1645712033.jpg,"Доступно вИмяКонтактыНаличиеLIBRARIUS 410Chisinau, Str. Mircea cel Bătrîn, 24/6078 747 410В наличииLIBRARIUS 422Chisinau, str. Piața Unirii Principatelor, 3078747422В наличии",Классическая литература,https://librarius.md/ru/book/besy-672160
Шестерка воронов,16.99,Есть на стоке,https://cdn.librarius.md/img/original/shesterka-voronov_1645711148.jpg,"Доступно вИмяКонтактыНаличиеLIBRARIUS 401Chisinau, Str. Zelinski, 11/1078 747 401В наличииLIBRARIUS 406Chisinau, Str. Zelinski, 7078 747 406В наличииLIBRARIUS 403Chisinau, Str. Puşkin, 22078 747 403В наличииLIBRARIUS 404Chisinau, Ștefan cel Mare și Sfînt 8, (CC UNIC)078 747 404В наличииLIBRARIUS 405Chisinau, Str. Mircea cel Bătrîn, 10078 747 405В наличииLIBRARIUS 409Chisinau, str. L.Tolstoi, 24/1 (mag. Nr.1)078 747 409В наличииLIBRARIUS 408Chisinau, or. Chișinău, str. Dacia 47/6078 747 455В наличииLIBRARIUS 410Chisinau, Str. Mircea cel Bătrîn, 24/6078 747 410В наличииLIBRARIUS 412Chisinau, Bd. Moscova, 1/1078 747 412В наличииLIBRARIUS 417Chisinau, str. Calea Ieșilor 5078747417В наличииLIBRARIUS 418Chisinau, bd. Moscovei 9/5078747418В наличииLIBRARIUS 420Chisinau, str. V. Dokuceaev, 13078747420В наличииLIBRARIUS 421Chisinau, str. Ceucari 2/6078747421В наличииLIBRARIUS 422Chisinau, str. Piața Unirii Principatelor, 3078747422В наличииLibrarius 423Chisinau,  bd. Ștefan cel Mare, 6076607423В наличииLIBRARIUS 425Chisinau, str. A. Russo, 59/8078747425В наличииLIBRARIUS 429Chisinau, str. Dacia 30/1078747449В наличииLIBRARIUS 434Chisinau, str. Ștefan cel Mare 64078747454В наличииLIBRARIUS 440Chisinau,  str. M. Varlaam, 75078333440В наличииLIBRARIUS 444Chisinau, str. Bogdan Voievod, 1 (Oasis Mall)078011444В наличииLibrarius 445Chisinau, str. Arborilor 21, et 4079366445В наличииLibrarius 446Chisinau, bd. Dacia 16/1079403446В наличии","Зарубежная фантастика, фэнтези, мистика",https://librarius.md/ru/book/shesterka-voronov-671945
Тень и кость,13.99,Сток лимитирован,https://cdn.librarius.md/img/original/teni-i-kosti_1645710679.jpg,"Доступно вИмяКонтактыНаличиеLIBRARIUS 407Chisinau, Str. Creangă, 78078 747 407В наличииLIBRARIUS 434Chisinau, str. Ștefan cel Mare 64078747454В наличии","Зарубежная фантастика, фэнтези, мистика",https://librarius.md/ru/book/teni-i-kosti-671944
Повелитель мух,9.99,Последняя книга,https://cdn.librarius.md/img/original/poveliteli-muh_1627995941.jpg,"«Повелитель мух».Странная, страшная и бесконечно притягательная книга.История благовоспитанных мальчиков, внезапно оказавшихся на необитаемом острове.Философская притча о том, что может произойти с людьми, забывшими о любви и милосердии.Гротескная антиутопия, роман-предупреждение и, конечно, напоминание о хрупкости мира, в котором живем мы все.",Зарубежная классическая проза и драматургия,https://librarius.md/ru/book/poveliteli-muh-670403
Посторонний,,Not specified,https://cdn.librarius.md/img/original/postoronniy_1627994233.jpg,"""Посторонний"" - дебютная работа молодого писателя, своеобразный творческий манифест. Понятие абсолютной свободы - основной постулат этого манифеста. Героя этой повести судят за убийство, которое он совершил по самой глупой из всех возможных причин. И это правда, которую герой не боится бросить в лицо своим судьям, пойти наперекор всему, забыть обо всех условностях и умереть во имя своих убеждений.",Универсальная литература,https://librarius.md/ru/book/postoronniy-670399
Глазами жертвы,11.99,Последняя книга,https://cdn.librarius.md/img/original/glazami-zhertvy_1626432567.jpeg,"Продолжение бестселлеров «ВНУТРИ УБИЙЦЫ» (самый популярный роман в России в 2020 г.) и «ЗАЖИВО В ТЕМНОТЕ». В этом романе многолетний кошмар Зои Бентли наконец-то закончится.Он — убийца-маньяк, одержимый ею.Она — профайлер ФБР, идущая по его следу.Она может думать, как убийца.Потому что когда-то была его жертвой...УБИЙЦА, ПЬЮЩИЙ КРОВЬ СВОИХ ЖЕРТВ?Профайлер ФБР Зои Бентли и ее напарник, агент Тейтум Грей, повидали в жизни всякое. И все же при виде тела этой мертвой девушки даже их пробирала дрожь.ВАМПИР? ВРЯД ЛИ. НО И НЕ ЧЕЛОВЕК...Почерк убийства схож с жуткими расправами Рода Гловера — маньяка, за которым они гоняются уже не первый месяц. Зои уверена — это его рук дело. Какие же персональные демоны, из каких самых темных глубин подсознания, могут заставить совершать подобные ужасы? Ответ на этот вопрос — ключ ко всему.ОДНАКО МНОГОЕ ВЫГЛЯДИТ СТРАННО.Убийство произошло в доме, а не на улице. Жертве зачем-то несколько раз вводили в руку иглу. После смерти кто-то надел ей на шею цепочку с кулоном и укрыл одеялом. И, главное: на месте убийства обнаружены следы двух разных пар мужских ботинок…",Зарубежная остросюжетная литература,https://librarius.md/ru/book/glazami-zhertvy-668963
Naruto. Наруто. Книга 1. Наруто Удзумаки,21.99,Есть на стоке,https://cdn.librarius.md/img/original/naruto-naruto-kniga-1-naruto-udzumaki_1645779303.jpg,"Наруто Удзумаки — самый проблемный ученик академии ниндзя в деревне Коноха. День за днем он выдумывает всяческие проказы и выводит из себя окружающих! Однако даже у этого хулигана есть заветная мечта. Он собирается превзойти героев прошлого, стать величайшим ниндзя и обрести всеобщее признание! Но люди сторонятся юного Удзумаки, а кто-то даже смотрит на него с отвращением... Наруто и не подозревает, что его жизнь связана с трагедией, постигшей Коноху двенадцать лет назад...Издание включает:Том 1. Наруто УдзумакиТом 2. Заявитель хуже не придумаешьТом 3. Во имя мечты!!!","Манга, комиксы, графические романы",https://librarius.md/ru/book/naruto-naruto-kniga-1-naruto-udzumaki-666238
Зеленый свет,18.99,Есть на стоке,https://cdn.librarius.md/img/original/zelenyy-svet_1617358038.jpg,"Впервые на русском — одно из главных книжных событий 2020 года, «Зеленый свет» знаменитого Мэттью Макконахи (лауреат «Оскара» за главную мужскую роль в фильме «Далласский клуб покупателей», Раст Коул в сериале «Настоящий детектив», Микки Пирсон в «Джентльменах» Гая Риччи) — отчасти иллюстрированная автобиография, отчасти учебник жизни. Став на рубеже веков звездой романтических комедий, Макконахи решил переломить судьбу и реализоваться как серьезный драматический актер. Он рассказывает о том, чего ему стоило это решение — и другие судьбоносные решения в его жизни: уехать после школы на год в Австралию, сменить юридический факультет на институт кинематографии, три года прожить на колесах, путешествуя от одной съемочной площадки к другой на автотрейлере в компании дворняги по кличке Мисс Хад, и главное — заслужить уважение отца …Итак, слово — автору: «Тридцать пять лет я осмысливал, вспоминал, распознавал, собирал и записывал то, что меня восхищало или помогало мне на жизненном пути. Как быть честным. Как избежать стресса. Как радоваться жизни. Как не обижать людей. Как не обижаться самому. Как быть хорошим. Как добиваться желаемого. Как обрести смысл жизни. Как быть собой».",Художественная литература,https://librarius.md/ru/book/zelenyy-svet-662537
